{
  "schema_version": "1.0",
  "bundle_id": "vllm-core.lmcache-bridges",
  "bundle_version": "1.0.0",
  "host_api_range": ">=1,<2",
  "components": [
    {
      "component_id": "v1-scheduler",
      "contracts": ["vllm.kv_connector.scheduler.v1"],
      "execution_planes": ["scheduler"],
      "isolation": "trusted_in_process",
      "implementation_ref": "vllm.distributed.kv_transfer.kv_connector.v1.lmcache_connector:LMCacheConnectorV1",
      "permissions": ["filesystem_read", "filesystem_write", "ipc", "network_egress", "shared_memory", "subprocess"]
    },
    {
      "component_id": "v1-worker",
      "contracts": ["vllm.kv_connector.worker.v1"],
      "execution_planes": ["worker", "device"],
      "isolation": "trusted_in_process",
      "implementation_ref": "vllm.distributed.kv_transfer.kv_connector.v1.lmcache_connector:LMCacheConnectorV1",
      "permissions": ["device_access", "filesystem_read", "filesystem_write", "ipc", "network_egress", "shared_memory", "subprocess"]
    },
    {
      "component_id": "v1-telemetry",
      "contracts": ["vllm.kv_connector.telemetry.v1"],
      "execution_planes": ["api"],
      "isolation": "trusted_in_process",
      "implementation_ref": "vllm.plugins.builtin_kv_bundles.lmcache_telemetry:LMCacheTelemetryProvider",
      "permissions": []
    },
    {
      "component_id": "multiprocess-scheduler",
      "contracts": ["vllm.kv_connector.scheduler.v1"],
      "execution_planes": ["scheduler"],
      "isolation": "trusted_in_process",
      "implementation_ref": "vllm.distributed.kv_transfer.kv_connector.v1.lmcache_mp_connector:LMCacheMPConnector",
      "permissions": ["filesystem_read", "filesystem_write", "ipc", "network_egress", "shared_memory", "subprocess"]
    },
    {
      "component_id": "multiprocess-worker",
      "contracts": ["vllm.kv_connector.worker.v1"],
      "execution_planes": ["worker", "device"],
      "isolation": "trusted_in_process",
      "implementation_ref": "vllm.distributed.kv_transfer.kv_connector.v1.lmcache_mp_connector:LMCacheMPConnector",
      "permissions": ["device_access", "filesystem_read", "filesystem_write", "ipc", "network_egress", "shared_memory", "subprocess"]
    },
    {
      "component_id": "multiprocess-telemetry",
      "contracts": ["vllm.kv_connector.telemetry.v1"],
      "execution_planes": ["api"],
      "isolation": "trusted_in_process",
      "implementation_ref": "vllm.plugins.builtin_kv_bundles.lmcache_telemetry:LMCacheTelemetryProvider",
      "permissions": []
    }
  ]
}
